{
  "schema_version": "0.1.0",
  "entries": [
    {
      "source_unit_id": "human-bug",
      "findings": [
        {
          "candidate_id": "import-1",
          "title": "Invalid numeric identifiers return a server error.",
          "body": "An invalid identifier reaches int() without error handling. The resulting ValueError escapes the endpoint and returns HTTP 500 instead of the required HTTP 400.",
          "severity": "major",
          "category": "correctness",
          "relationship": "pr_related",
          "locations": [
            {
              "path": "app/views.py",
              "start_line": 21,
              "end_line": 23,
              "side": "RIGHT",
              "revision_role": "head"
            }
          ],
          "evidence": [
            {
              "kind": "discussion",
              "explanation": "Human reviewer asserts that unhandled ValueError produces a server error; this is an assertion awaiting verification.",
              "source_ids": [
                "human-bug"
              ],
              "location": null,
              "artifact_id": null
            }
          ],
          "suggestion": null,
          "primary_location": {
            "path": "app/views.py",
            "start_line": 21,
            "end_line": 23,
            "side": "RIGHT",
            "revision_role": "head"
          },
          "rule_id": null,
          "existing_finding_id": null
        }
      ],
      "explanation": "One concrete asserted correctness defect."
    }
  ],
  "limitations": [],
  "omission_resolutions": [
    {
      "omission_id": "missed-1",
      "outcome": "imported",
      "candidate_ids": [
        "import-1"
      ],
      "reason": "The authenticated comment asserts the failure; import it for independent verification."
    }
  ]
}
